{
  "schema": "sourcefold.tome.v0",
  "id": "coc:tome:book-of-iod-ancient-tongue",
  "kind": "tome",
  "name": {
    "ru": "Книга Иода (древнее наречие)",
    "en": "Book of Iod (ancient tongue)"
  },
  "tome_type": "mythos_tome",
  "edition_of": "coc:tome:book-of-iod",
  "language": "Древнее наречие",
  "author": "Неизвестен",
  "reading": {
    "sanity_loss": "2d6",
    "mythos_initial": "+4%",
    "mythos_full": "+8%",
    "mythos_rating": 36,
    "study_time": "51 неделя",
    "raw": "Книга Иода | Древнее наречие |  | Неизвестен | 51 | 2d6 | +4 | +8 | 36"
  },
  "axes": {
    "era": [
      "any"
    ],
    "ruleset": "core"
  },
  "sources": [
    {
      "book_id": "keeper-rulebook-ru",
      "physical_page": 217,
      "printed_page": 235,
      "method": "book_text",
      "verified": true,
      "note": "строка таблицы XI (название | язык | год/век | автор | недель | РАС | МКН | МКП | ЗМ)"
    },
    {
      "book_id": "keeper-rulebook-en",
      "physical_page": 237,
      "printed_page": 236,
      "method": "book_text",
      "verified": true
    }
  ],
  "quality": {
    "needs_review": false,
    "flags": []
  }
}
