{
  "schema": "sourcefold.tome.v0",
  "id": "coc:tome:testament-of-carnamagos",
  "kind": "tome",
  "name": {
    "ru": "Завет Карнамагоса",
    "en": "Testament of Carnamagos"
  },
  "tome_type": "mythos_tome",
  "edition_of": null,
  "language": "Греческий",
  "author": "Карнамагос",
  "date": "XII в.",
  "description": {
    "ru": "В «Книге хранителя» описания нет — только строка таблицы XI «Книги Мифов»: греческий, Карнамагос, XII в.",
    "en": null
  },
  "reading": {
    "sanity_loss": "1d6",
    "mythos_initial": "+2%",
    "mythos_full": "+4%",
    "occult": null,
    "mythos_rating": 18,
    "study_time": "23 недели",
    "raw": "Завет Карнамагоса | Греческий | XII в. | Карнамагос | 23 | 1d6 | +2 | +4 | 18"
  },
  "axes": {
    "era": [
      "any"
    ],
    "ruleset": "core"
  },
  "sources": [
    {
      "book_id": "keeper-rulebook-ru",
      "physical_page": 217,
      "printed_page": 235,
      "method": "book_text",
      "verified": true,
      "note": "таблица XI «Книги Мифов»"
    },
    {
      "book_id": "keeper-rulebook-en",
      "physical_page": 239,
      "printed_page": 238,
      "method": "book_text",
      "verified": true,
      "note": "Table XI: Mythos Tomes"
    }
  ],
  "quality": {
    "needs_review": false,
    "flags": []
  }
}
