{
  "schema": "sourcefold.tome.v0",
  "id": "coc:tome:selections-de-livre-divon",
  "kind": "tome",
  "name": {
    "ru": "Sélections de Livre D’Ivon",
    "en": "Sélections de Livre D’Ivon"
  },
  "tome_type": "mythos_tome",
  "edition_of": "coc:tome:book-of-eibon",
  "language": "Французский",
  "author": "Гаспар дю Нор",
  "date": "прибл. XIII в.",
  "description": {
    "ru": "Французский комментарий Гаспара дю Нора к латинскому оригиналу «Книги Эйбона», около XIII века: рукопись ин-октаво в истлевающем синем переплёте из телячьей кожи. Считается, что дю Нор переписал её с более ранней греческой рукописи; известно лишь 13 экземпляров, полных и неполных. Рукопись, на которую опирался дю Нор, могла попасть в Аверуан прямо из Атлантиды — или, как предполагают, случайно через Древний Египет. Это вариант Liber Ivonis с множеством полезных заклинаний и трактатов о практической магии, но с уклоном в почитание божества по имени Цатхоггуа. На полях нарисовано нечто очень похожее на перевёрнутый сломанный анх — знак Братства Чёрного фараона, — и есть рассуждение о вражде «Пазз-Луззы» с божеством по имени Ноденс.\nВ «Масках Ньярлатхотепа» (прил. C, Америка) рукопись стоит в библиотеке особняка Карлайла (с. 134).",
    "en": null
  },
  "reading": {
    "sanity_loss": "2d4",
    "mythos_initial": "+4%",
    "mythos_full": "+8%",
    "mythos_rating": 36,
    "study_time": "36 недель",
    "raw": "Sanity Loss: 2D4; Cthulhu Mythos: +4/+8 percentiles; Mythos Rating: 36; Study: 36 weeks"
  },
  "spells": [
    {
      "name": "Call/Dismiss the Blind Lord of Chaos (Azathoth)",
      "spell": "coc:spell:call-dismiss-azathoth"
    },
    {
      "name": "Contact Formless Spawn of Zhothaqquah (Formless Spawn)",
      "spell": "coc:spell:contact-formless-spawn"
    },
    {
      "name": "Contact Deity/The Lord of the Waters (Nodens)",
      "spell": "coc:spell:contact-nodens"
    },
    {
      "name": "Contact Deity/Zhothaqquah (Tsathoggua)",
      "spell": "coc:spell:contact-tsathoggua"
    },
    {
      "name": "Create Barrier of Naach-Tith",
      "spell": "coc:spell:create-barrier-of-naach-tith"
    },
    {
      "name": "Gate",
      "spell": "coc:spell:create-gate"
    },
    {
      "name": "Fog of Misdirection (Create Mist of R’lyeh)",
      "spell": "coc:spell:create-mist-of-rlyeh"
    },
    {
      "name": "Eibon’s Wheel of Mist**",
      "spell": "coc:spell:eibons-wheel-of-mist"
    }
  ],
  "refs": [
    "coc:creature:tsathoggua",
    "coc:creature:nodens"
  ],
  "axes": {
    "era": [
      "1920s"
    ],
    "ruleset": "core"
  },
  "sources": [
    {
      "book_id": "masks-of-nyarlathotep-en",
      "physical_page": 643,
      "printed_page": 640,
      "method": "book_text",
      "verified": true
    },
    {
      "book_id": "masks-of-nyarlathotep-en",
      "physical_page": 644,
      "printed_page": 641,
      "method": "book_text",
      "verified": true
    }
  ],
  "quality": {
    "needs_review": false,
    "flags": [
      "translated"
    ],
    "notes": "Книга есть только в «Масках Ньярлатхотепа». Список заклинаний — английские названия «Масок»; ** — заклинание описано только в Grand Grimoire."
  }
}
