{
  "schema": "sourcefold.tome.v0",
  "id": "coc:tome:fourth-book-of-dharsis",
  "kind": "tome",
  "name": {
    "ru": "Четвёртая книга Д’харсиса",
    "en": "Fourth Book of D’harsis"
  },
  "tome_type": "mythos_tome",
  "edition_of": null,
  "language": "Английский",
  "author": "Д’харсис",
  "description": {
    "ru": "Книга Мифов на английском языке, автор — Д’харсис. В «Книге хранителя» приведена только строкой таблицы XI, без описания и без списка заклинаний.",
    "en": null
  },
  "reading": {
    "sanity_loss": "2d6",
    "mythos_initial": "+3%",
    "mythos_full": "+8%",
    "mythos_rating": 33,
    "study_time": "42 недели",
    "raw": "Таблица XI: Четвёртая книга Д’харсиса | Английский |  | Д’харсис | 42 | 2d6 | +3 | +8 | 33"
  },
  "axes": {
    "era": [
      "any"
    ],
    "ruleset": "core"
  },
  "sources": [
    {
      "book_id": "keeper-rulebook-ru",
      "physical_page": 219,
      "printed_page": 237,
      "method": "book_text",
      "verified": true,
      "note": "строка таблицы XI"
    },
    {
      "book_id": "keeper-rulebook-en",
      "physical_page": 238,
      "printed_page": 237,
      "method": "book_text",
      "verified": true,
      "note": "строка таблицы XI"
    }
  ],
  "quality": {
    "needs_review": false,
    "flags": []
  }
}
