{
  "schema": "sourcefold.tome.v0",
  "id": "coc:tome:oracles-of-nostradamus",
  "kind": "tome",
  "name": {
    "ru": "Предсказания Мишеля Нострадамуса",
    "en": "Oracles of Nostradamus"
  },
  "tome_type": "occult_book",
  "edition_of": null,
  "language": "Разные",
  "author": "Мишель де Нотрдам (Нострадамус)",
  "date": "1555–1557 гг.",
  "description": {
    "ru": "Около тысячи четверостиший, написанных Мишелем де Нотрдамом в 1555–1557 гг. и выходивших на разных языках; их считают пророчествами о событиях вплоть до 3797 года. Предсказания туманны и иносказательны, поэтому толковать их можно очень широко, и у многих есть масса разных трактовок.",
    "en": null
  },
  "reading": {
    "sanity_loss": "нет",
    "occult": "+1%",
    "raw": "Потеря рассудка: нет. Оккультизм: +1%."
  },
  "axes": {
    "era": [
      "any"
    ],
    "ruleset": "core"
  },
  "sources": [
    {
      "book_id": "keeper-rulebook-ru",
      "physical_page": 216,
      "printed_page": 234,
      "method": "book_text",
      "verified": true
    },
    {
      "book_id": "keeper-rulebook-en",
      "physical_page": 236,
      "printed_page": 235,
      "method": "book_text",
      "verified": true
    }
  ],
  "quality": {
    "needs_review": false,
    "flags": []
  }
}
