{
  "schema": "sourcefold.tome.v0",
  "id": "coc:tome:legends-of-liqualia",
  "kind": "tome",
  "name": {
    "ru": "Легенды Ликвалии",
    "en": "Legends of Liqualia"
  },
  "tome_type": "mythos_tome",
  "edition_of": null,
  "language": "Английский",
  "author": "Освальд",
  "reading": {
    "sanity_loss": "1d4",
    "mythos_initial": "+1%",
    "mythos_full": "+3%",
    "mythos_rating": 12,
    "study_time": "9 недель",
    "raw": "Легенды Ликвалии | Английский |  | Освальд | 9 | 1d4 | +1 | +3 | 12"
  },
  "axes": {
    "era": [
      "any"
    ],
    "ruleset": "core"
  },
  "sources": [
    {
      "book_id": "keeper-rulebook-ru",
      "physical_page": 217,
      "printed_page": 235,
      "method": "book_text",
      "verified": true,
      "note": "строка таблицы XI (название | язык | год/век | автор | недель | РАС | МКН | МКП | ЗМ)"
    },
    {
      "book_id": "keeper-rulebook-en",
      "physical_page": 238,
      "printed_page": 237,
      "method": "book_text",
      "verified": true
    }
  ],
  "quality": {
    "needs_review": false,
    "flags": []
  }
}
