{
  "schema": "sourcefold.tome.v0",
  "id": "coc:tome:secret-watcher",
  "kind": "tome",
  "name": {
    "ru": "Тайный наблюдатель",
    "en": "The Secret Watcher"
  },
  "tome_type": "mythos_tome",
  "edition_of": null,
  "language": "Английский",
  "author": "Холпин Челмерс",
  "description": {
    "ru": "Книга Мифов на английском языке, автор — Холпин Челмерс. В «Книге хранителя» приведена только строкой таблицы XI, без описания и без списка заклинаний.",
    "en": null
  },
  "reading": {
    "sanity_loss": "1d4",
    "mythos_initial": "+1%",
    "mythos_full": "+3%",
    "mythos_rating": 12,
    "study_time": "10 недель",
    "raw": "Таблица XI: Тайный наблюдатель | Английский |  | Холпин Челмерс | 10 | 1d4 | +1 | +3 | 12"
  },
  "axes": {
    "era": [
      "any"
    ],
    "ruleset": "core"
  },
  "sources": [
    {
      "book_id": "keeper-rulebook-ru",
      "physical_page": 219,
      "printed_page": 237,
      "method": "book_text",
      "verified": true,
      "note": "строка таблицы XI"
    },
    {
      "book_id": "keeper-rulebook-en",
      "physical_page": 239,
      "printed_page": 238,
      "method": "book_text",
      "verified": true,
      "note": "строка таблицы XI"
    }
  ],
  "quality": {
    "needs_review": false,
    "flags": []
  }
}
