{
  "schema": "sourcefold.tome.v0",
  "id": "coc:tome:africas-dark-sects",
  "kind": "tome",
  "name": {
    "ru": "Тёмные секты Африки",
    "en": "Africa’s Dark Sects"
  },
  "aliases": [
    "Темные секты Африки"
  ],
  "tome_type": "mythos_tome",
  "edition_of": null,
  "language": "Английский",
  "author": "Найджел Блэкуэлл",
  "date": "1920 г.",
  "description": {
    "ru": "Книга исследователя Найджела Блэкуэлла (1920), секстодецимо в синем картонном переплёте с мраморными форзацами и синим обрезом. Это странная смесь путевых заметок и разоблачения ритуалов разных африканских культов; издательство на титуле не указано, автора найти невозможно, и некоторые подозревают псевдоним. Известно лишь 13 экземпляров — остальные власти сожгли. В кампании книгу похитил из библиотеки Уайденера в Гарварде Мукунга М’Дари с помощью охотящегося ужаса; Блэкуэлл в 1916 году случайно стал свидетелем призыва М’Веру Ньярлатхотепа в облике Кровавого языка и подробно его описал.\nВ «Масках Ньярлатхотепа» книга лежит в нише М’Дари в Доме Джу-Джу (сцена «Ужас в Доме Джу-Джу», с. 157).",
    "en": null
  },
  "reading": {
    "sanity_loss": "1d10",
    "mythos_initial": "+2%",
    "mythos_full": "+4%",
    "occult": null,
    "mythos_rating": 30,
    "study_time": "6 недель",
    "raw": "Sanity Loss: 1D10 • Cthulhu Mythos: +2/+4 percentiles • Mythos Rating: 30 • Study: 6 weeks"
  },
  "spells": [
    {
      "name": "Create Ciimba*",
      "spell": "coc:spell:create-ciimba"
    }
  ],
  "refs": [
    "coc:creature:bloody-tongue",
    "coc:creature:hunting-horror"
  ],
  "axes": {
    "era": [
      "1920s"
    ],
    "ruleset": "core"
  },
  "sources": [
    {
      "book_id": "masks-of-nyarlathotep-en",
      "physical_page": 644,
      "printed_page": 641,
      "method": "book_text",
      "verified": true
    }
  ],
  "corrections": [
    {
      "field": "spells",
      "from": null,
      "to": "Create Ciimba*",
      "reason": "В помощнике у книги нет заклинаний; в «Масках» указано одно",
      "ref": "masks-of-nyarlathotep-en p.641 (phys. 644)"
    }
  ],
  "quality": {
    "needs_review": false,
    "flags": [
      "translated"
    ],
    "notes": "Create Ciimba — заклинание из прил. B «Масок»."
  }
}
