{
  "schema": "sourcefold.tome.v0",
  "id": "coc:tome:pnakotic-manuscripts",
  "kind": "tome",
  "name": {
    "ru": "Пнакотические манускрипты",
    "en": "Pnakotic Manuscripts"
  },
  "tome_type": "mythos_tome",
  "edition_of": null,
  "language": "Английский",
  "author": "автор и переводчик неизвестны",
  "date": "XV век",
  "description": {
    "ru": "В каталогах Европы и Америки значатся пять переплетённых рукописных версий этой книги — частичных копий большего, ныне утраченного труда. Её очевидный предшественник, «Пнакотика», был написан на древнегреческом, а корнями, вероятно, уходит к дочеловеческой расе криноидов, принёсших жизнь на Землю.\nВ «Масках Ньярлатхотепа» (прил. C, библиотека особняка Карлайла, с. 134) экземпляр ин-кварто в тиснёном красном переплёте, более позднем, чем сама рукопись. По «Маскам», одна копия хранится в Мискатонике, другая, по слухам, в Нью-Йоркской публичной библиотеке; авторами оригинала одни считают Старцев, другие — Великую Расу Йит. В экземпляре Карлайла есть заметки о городе Великой Расы.",
    "en": null
  },
  "reading": {
    "sanity_loss": "1d8",
    "mythos_initial": "+3%",
    "mythos_full": "+7%",
    "mythos_rating": 30,
    "study_time": "45 недель",
    "raw": "Потеря рассудка: 1d8. Мифы Ктулху: +3/+7%. Значение Мифов: 30. Изучение: 45 недель."
  },
  "spells": [
    {
      "name": "Связь с крылатым созданием («Связь со Старцем»)",
      "spell": "coc:spell:contact-elder-thing"
    }
  ],
  "copies": [
    {
      "book_id": "masks-of-nyarlathotep-en",
      "physical_page": 643,
      "printed_page": 640,
      "where": "Америка, Нью-Йорк: библиотека особняка Роджера Карлайла (с. 134)",
      "spells": [
        {
          "name": "Contact Winged One (Elder Thing)",
          "spell": "coc:spell:contact-elder-thing"
        },
        {
          "name": "Contact Mind of the Observer (Yithian)",
          "spell": "coc:spell:contact-yithian"
        }
      ]
    }
  ],
  "refs": [
    "coc:creature:elder-thing"
  ],
  "axes": {
    "era": [
      "any"
    ],
    "ruleset": "core"
  },
  "sources": [
    {
      "book_id": "keeper-rulebook-ru",
      "physical_page": 212,
      "printed_page": 229,
      "method": "book_text",
      "verified": true
    },
    {
      "book_id": "keeper-rulebook-ru",
      "physical_page": 218,
      "printed_page": 236,
      "method": "book_text",
      "verified": true,
      "note": "строка таблицы XI"
    },
    {
      "book_id": "keeper-rulebook-en",
      "physical_page": 233,
      "printed_page": 232,
      "method": "book_text",
      "verified": true
    },
    {
      "book_id": "keeper-rulebook-en",
      "physical_page": 238,
      "printed_page": 237,
      "method": "book_text",
      "verified": true,
      "note": "строка таблицы XI"
    },
    {
      "book_id": "masks-of-nyarlathotep-en",
      "physical_page": 643,
      "printed_page": 640,
      "method": "book_text",
      "verified": true
    }
  ],
  "quality": {
    "needs_review": false,
    "flags": [
      "translated"
    ],
    "notes": "В «Масках Ньярлатхотепа» у экземпляра те же числа."
  }
}
