{
  "schema": "sourcefold.tome.v0",
  "id": "coc:tome:al-azif",
  "kind": "tome",
  "name": {
    "ru": "Аль-Азиф",
    "en": "Al Azif"
  },
  "aliases": [
    "Китаб аль-Азиф",
    "Kitab Al-Azif",
    "Al-Azif"
  ],
  "tome_type": "mythos_tome",
  "edition_of": "coc:tome:necronomicon",
  "language": "Арабский",
  "author": "Абдул Альхазред (Абд аль-Азрад)",
  "date": "ок. 730 г. н. э.",
  "description": {
    "ru": "Первоначальная арабская версия «Некрономикона». Каким был подлинник, неизвестно, но многочисленные рукописные переложения долго ходили среди средневековых учёных; уже в XII веке эту версию считали утраченной. Это самая полная версия: в ней подробно разобраны почти все стороны Мифов, есть справочный раздел с таблицами и звёздными картами.\nВ «Масках Ньярлатхотепа» (прил. C, Египетский музей, с. 322) экземпляр — десять хрупких свитков IX века на тонком козьем пергаменте в чёрных кожаных футлярах; части текста нет.",
    "en": null
  },
  "reading": {
    "sanity_loss": "2d10",
    "mythos_initial": "+6%",
    "mythos_full": "+12%",
    "mythos_rating": 54,
    "study_time": "68 недель",
    "raw": "Потеря рассудка: 2d10. Мифы Ктулху: +6/+12%. Значение Мифов: 54. Изучение: 68 недель."
  },
  "spells": [
    {
      "name": "«Вызов/изгнание Азатота»",
      "spell": "coc:spell:call-dismiss-azathoth"
    },
    {
      "name": "«Вызов/изгнание Ктугхи»",
      "spell": "coc:spell:call-dismiss-cthugha"
    },
    {
      "name": "«Вызов/изгнание Хастура»",
      "spell": "coc:spell:call-dismiss-hastur"
    },
    {
      "name": "«Вызов/изгнание Ниогты»",
      "spell": "coc:spell:call-dismiss-nyogtha"
    },
    {
      "name": "«Вызов/изгнание Шуб-Ниггурат»",
      "spell": "coc:spell:call-dismiss-shub-niggurath"
    },
    {
      "name": "«Вызов/изгнание Йог-Сотота»",
      "spell": "coc:spell:call-dismiss-yog-sothoth"
    },
    {
      "name": "«Связь с упырём»",
      "spell": "coc:spell:contact-ghoul"
    },
    {
      "name": "«Связь с божеством: Ньярлатхотеп»",
      "spell": "coc:spell:contact-nyarlathotep"
    },
    {
      "name": "«Связь с обитателем песков»",
      "spell": "coc:spell:contact-sand-dweller"
    },
    {
      "name": "«Покорение»",
      "spell": "coc:spell:dominate"
    },
    {
      "name": "«Зловещее проклятье Азатота»",
      "spell": "coc:spell:dread-curse-of-azathoth"
    },
    {
      "name": "«Прах Сулеймана»",
      "spell": "coc:spell:dust-of-suleiman"
    },
    {
      "name": "«Знак Старших богов»",
      "spell": "coc:spell:elder-sign"
    },
    {
      "name": "«Порошок Ибн-Гази»",
      "spell": "coc:spell:powder-of-ibn-ghazi"
    },
    {
      "name": "«Воскрешение»",
      "spell": "coc:spell:resurrection"
    },
    {
      "name": "«Иссушение»",
      "spell": "coc:spell:shrivelling"
    },
    {
      "name": "«Призыв/укрощение бьякхи»",
      "spell": "coc:spell:summon-bind-byakhee"
    },
    {
      "name": "«Призыв/укрощение огненного вампира»",
      "spell": "coc:spell:summon-bind-fire-vampire"
    },
    {
      "name": "«Призыв/укрощение служителя Внешних богов»",
      "spell": "coc:spell:summon-bind-servitor-of-the-outer-gods"
    },
    {
      "name": "«Вурский знак»",
      "spell": "coc:spell:voorish-sign"
    }
  ],
  "copies": [
    {
      "book_id": "masks-of-nyarlathotep-en",
      "physical_page": 646,
      "printed_page": 643,
      "where": "Египет, Каир: Египетский музей (с. 322); доктор Али Кафур неохотно даёт читать свитки",
      "spells": [
        {
          "name": "Entreat the Daemon Sultan (Call/Dismiss Azathoth)",
          "spell": "coc:spell:call-dismiss-azathoth"
        },
        {
          "name": "Bring Down the Lord of Flames (Call/Dismiss Cthugha)",
          "spell": "coc:spell:call-dismiss-cthugha"
        },
        {
          "name": "Call to That Which Must Not Be Named (Call/Dismiss Hastur)",
          "spell": "coc:spell:call-dismiss-hastur"
        },
        {
          "name": "Speak with the Dark One (Call/Dismiss Nyogtha)",
          "spell": "coc:spell:call-dismiss-nyogtha"
        },
        {
          "name": "Hail to the Mother of All Things (Call/Dismiss Shub-Niggurath)",
          "spell": "coc:spell:call-dismiss-shub-niggurath"
        },
        {
          "name": "Call/Dismiss Yog-Sothoth",
          "spell": "coc:spell:call-dismiss-yog-sothoth"
        },
        {
          "name": "To Bring Carrion Eaters (Contact Ghoul)",
          "spell": "coc:spell:contact-ghoul"
        },
        {
          "name": "Song of Chaos (Contact Deity/Nyarlathotep)",
          "spell": "coc:spell:contact-nyarlathotep"
        },
        {
          "name": "To Bring Those Who Dwell Beneath the Desert (Contact Sand-Dweller)",
          "spell": "coc:spell:contact-sand-dweller"
        },
        {
          "name": "Dominate",
          "spell": "coc:spell:dominate"
        },
        {
          "name": "Dread Curse of Azathoth",
          "spell": "coc:spell:dread-curse-of-azathoth"
        },
        {
          "name": "Dust of Suleiman",
          "spell": "coc:spell:dust-of-suleiman"
        },
        {
          "name": "Elder Sign",
          "spell": "coc:spell:elder-sign"
        },
        {
          "name": "Powder of Ibn-Ghazi",
          "spell": "coc:spell:powder-of-ibn-ghazi"
        },
        {
          "name": "Resurrection",
          "spell": "coc:spell:resurrection"
        },
        {
          "name": "Shrivelling",
          "spell": "coc:spell:shrivelling"
        },
        {
          "name": "Bring Forth the Winged Steed (Summon/Bind Byakhee)",
          "spell": "coc:spell:summon-bind-byakhee"
        },
        {
          "name": "Summon/Bind Fire Vampire",
          "spell": "coc:spell:summon-bind-fire-vampire"
        },
        {
          "name": "Call Forth the One (Summon/Bind Servitor of the Outer Gods)",
          "spell": "coc:spell:summon-bind-servitor-of-the-outer-gods"
        },
        {
          "name": "Voorish Sign",
          "spell": "coc:spell:voorish-sign"
        }
      ]
    }
  ],
  "axes": {
    "era": [
      "any"
    ],
    "ruleset": "core"
  },
  "sources": [
    {
      "book_id": "keeper-rulebook-ru",
      "physical_page": 209,
      "printed_page": 226,
      "method": "book_text",
      "verified": true
    },
    {
      "book_id": "keeper-rulebook-ru",
      "physical_page": 217,
      "printed_page": 235,
      "method": "book_text",
      "verified": true,
      "note": "строка таблицы XI"
    },
    {
      "book_id": "keeper-rulebook-en",
      "physical_page": 231,
      "printed_page": 230,
      "method": "book_text",
      "verified": true
    },
    {
      "book_id": "keeper-rulebook-en",
      "physical_page": 237,
      "printed_page": 236,
      "method": "book_text",
      "verified": true,
      "note": "строка таблицы XI"
    },
    {
      "book_id": "masks-of-nyarlathotep-en",
      "physical_page": 646,
      "printed_page": 643,
      "method": "book_text",
      "verified": true
    }
  ],
  "corrections": [
    {
      "field": "name.ru",
      "from": "Аль-Азиф (Некрономикон)",
      "to": "Аль-Азиф",
      "reason": "название статьи в книге; связь с «Некрономиконом» — через edition_of",
      "ref": "keeper-rulebook-ru p.226"
    }
  ],
  "quality": {
    "needs_review": false,
    "flags": [
      "translated"
    ],
    "notes": "В «Масках Ньярлатхотепа» у экземпляра те же числа; часть заклинаний там названа по-книжному."
  }
}
