{
  "schema": "sourcefold.tome.v0",
  "id": "coc:tome:cabala-of-saboth",
  "kind": "tome",
  "name": {
    "ru": "Каббала Саваофа",
    "en": "Cabala of Saboth"
  },
  "tome_type": "mythos_tome",
  "edition_of": null,
  "language": "Греческий",
  "author": "Неизвестен",
  "date": "1686",
  "reading": {
    "sanity_loss": "1d6",
    "mythos_initial": "+1%",
    "mythos_full": "+2%",
    "mythos_rating": 9,
    "study_time": "16 недель",
    "raw": "Каббала Саваофа | Греческий | 1686 | Неизвестен | 16 | 1d6 | +1 | +2 | 9"
  },
  "axes": {
    "era": [
      "any"
    ],
    "ruleset": "core"
  },
  "sources": [
    {
      "book_id": "keeper-rulebook-ru",
      "physical_page": 217,
      "printed_page": 235,
      "method": "book_text",
      "verified": true,
      "note": "строка таблицы XI (название | язык | год/век | автор | недель | РАС | МКН | МКП | ЗМ)"
    },
    {
      "book_id": "keeper-rulebook-en",
      "physical_page": 237,
      "printed_page": 236,
      "method": "book_text",
      "verified": true
    }
  ],
  "quality": {
    "needs_review": false,
    "flags": []
  }
}
