{
  "schema": "sourcefold.tome.v0",
  "id": "coc:tome:ponape-scripture",
  "kind": "tome",
  "name": {
    "ru": "Понапское писание",
    "en": "Ponape Scripture"
  },
  "tome_type": "mythos_tome",
  "edition_of": null,
  "language": "Английский",
  "author": "капитан Эбнер Эзекиль Хоаг",
  "date": "1734 г.",
  "description": {
    "ru": "Издано посмертно около 1795 года в Бостоне маленьким томиком ин-секстодецимо (10×17 см). По точности и полноте печатный текст уступает рукописи Хоага, копии которой, возможно, сохранились. Книга описывает культ туземцев островов Микронезии, которые поклонялись Глубоководным и заводили от них потомство.",
    "en": null
  },
  "reading": {
    "sanity_loss": "1d6",
    "mythos_initial": "+1%",
    "mythos_full": "+4%",
    "mythos_rating": 15,
    "study_time": "10 недель",
    "raw": "Потеря рассудка: 1d6. Мифы Ктулху: +1/+4%. Значение Мифов: 15. Изучение: 10 недель."
  },
  "spells": [
    {
      "name": "«Связь с Глубоководными»",
      "spell": "coc:spell:contact-deep-one"
    },
    {
      "name": "«Связь с Отцом Дагоном»",
      "spell": "coc:spell:contact-father-dagon"
    },
    {
      "name": "«Связь с Матерью Гидрой»",
      "spell": "coc:spell:contact-mother-hydra"
    }
  ],
  "refs": [
    "coc:creature:deep-one",
    "coc:creature:deep-one-hybrid",
    "coc:creature:dagon-i-gidra"
  ],
  "axes": {
    "era": [
      "any"
    ],
    "ruleset": "core"
  },
  "sources": [
    {
      "book_id": "keeper-rulebook-ru",
      "physical_page": 212,
      "printed_page": 229,
      "method": "book_text",
      "verified": true
    },
    {
      "book_id": "keeper-rulebook-ru",
      "physical_page": 218,
      "printed_page": 236,
      "method": "book_text",
      "verified": true,
      "note": "строка таблицы XI"
    },
    {
      "book_id": "keeper-rulebook-en",
      "physical_page": 234,
      "printed_page": 233,
      "method": "book_text",
      "verified": true
    },
    {
      "book_id": "keeper-rulebook-en",
      "physical_page": 239,
      "printed_page": 238,
      "method": "book_text",
      "verified": true,
      "note": "строка таблицы XI"
    }
  ],
  "quality": {
    "needs_review": false,
    "flags": [],
    "notes": "В печатном издании заклинаний нет; перечисленные заклинания есть только в рукописи Хоага."
  }
}
