{
  "schema": "sourcefold.tome.v0",
  "id": "coc:tome:goddess-of-the-black-fan",
  "kind": "tome",
  "name": {
    "ru": "Богиня с чёрным веером",
    "en": "The Goddess of the Black Fan"
  },
  "tome_type": "mythos_tome",
  "edition_of": null,
  "language": "Китайский",
  "author": "Лю Чанфан",
  "description": {
    "ru": "Стихи монаха Лю о встрече с богиней, которая прячет лицо за чёрным веером. Богиня соблазняет его, открывает ему своё истинное имя и учит вызывать её из-за веера. Лю исполняет её волю — и в ужасе видит Раздутую женщину. Обезумев, он вспарывает себе живот серпом и пишет своей кровью последнее стихотворение. Имя Ньярлатхотепа в стихах не звучит, но одно из них действует как заклинание связи с Ньярлатхотепом в облике Раздутой женщины. Это один пергаментный свиток на классическом китайском, время написания неизвестно; хранится он в резном футляре из слоновой кости с серебряной филигранью.\nДля Ордена Раздутой женщины это основа учения и самая священная книга. Культ веками считал её утраченной; теперь, когда она вернулась, сектанты пойдут на всё и убьют кого угодно, чтобы снова её заполучить.\nВ «Масках Ньярлатхотепа» (прил. C, Китай) свиток лежит в тиковом шкафу святилища Раздутой женщины в Шанхае, среди книг Хо Фана (с. 560, 564); на нём, как и на «Комментариях к Тексту Р’льеха», дарственная надпись Карла Стэнфорда Хо Фану. Строки из этих стихов служат эпиграфом к описанию Раздутой женщины (с. 597).",
    "en": null
  },
  "reading": {
    "sanity_loss": "1d4",
    "mythos_initial": "+1%",
    "mythos_full": "+4%",
    "mythos_rating": 15,
    "study_time": "2 недели",
    "raw": "Sanity Loss: 1D4; Cthulhu Mythos: +1/+4 percentiles; Mythos Rating: 15; Study: 2 weeks"
  },
  "spells": [
    {
      "name": "Come, Mistress of the Fan (Contact Nyarlathotep/Bloated Woman)",
      "spell": "coc:spell:contact-nyarlathotep"
    }
  ],
  "refs": [
    "coc:creature:bloated-woman",
    "coc:creature:nyarlathotep"
  ],
  "axes": {
    "era": [
      "1920s"
    ],
    "ruleset": "core"
  },
  "sources": [
    {
      "book_id": "masks-of-nyarlathotep-en",
      "physical_page": 648,
      "printed_page": 645,
      "method": "book_text",
      "verified": true
    },
    {
      "book_id": "masks-of-nyarlathotep-en",
      "physical_page": 649,
      "printed_page": 646,
      "method": "book_text",
      "verified": true,
      "note": "описание и строка характеристик"
    },
    {
      "book_id": "masks-of-nyarlathotep-en",
      "physical_page": 567,
      "printed_page": 564,
      "method": "book_text",
      "verified": true,
      "note": "где лежит свиток: тиковый шкаф в святилище Раздутой женщины"
    }
  ],
  "quality": {
    "needs_review": false,
    "flags": [
      "translated"
    ],
    "notes": "Книга есть только в «Масках Ньярлатхотепа»."
  }
}
