{
  "schema": "sourcefold.tome.v0",
  "id": "coc:tome:sapientia-maglorum",
  "kind": "tome",
  "name": {
    "ru": "Sapientia Maglorum",
    "en": "Sapientia Maglorum"
  },
  "tome_type": "mythos_tome",
  "edition_of": null,
  "language": "Латынь",
  "author": "Остан",
  "description": {
    "ru": "В «Книге хранителя» описания нет — только строка таблицы XI «Книги Мифов»: латынь, Остан.",
    "en": null
  },
  "reading": {
    "sanity_loss": "2d6",
    "mythos_initial": "+3%",
    "mythos_full": "+7%",
    "occult": null,
    "mythos_rating": 30,
    "study_time": "40 недель",
    "raw": "Sapientia Maglorum | Латынь |  | Остан | 40 | 2d6 | +3 | +7 | 30"
  },
  "axes": {
    "era": [
      "any"
    ],
    "ruleset": "core"
  },
  "sources": [
    {
      "book_id": "keeper-rulebook-ru",
      "physical_page": 219,
      "printed_page": 237,
      "method": "book_text",
      "verified": true,
      "note": "таблица XI «Книги Мифов»"
    },
    {
      "book_id": "keeper-rulebook-en",
      "physical_page": 239,
      "printed_page": 238,
      "method": "book_text",
      "verified": true,
      "note": "Table XI: Mythos Tomes"
    }
  ],
  "quality": {
    "needs_review": false,
    "flags": []
  }
}
