{
  "schema": "sourcefold.tome.v0",
  "id": "coc:tome:confessions-of-the-mad-monk-clithanus",
  "kind": "tome",
  "name": {
    "ru": "Исповедь безумного монаха Клифана",
    "en": "Confessions of the Mad Monk Clithanus"
  },
  "tome_type": "mythos_tome",
  "edition_of": null,
  "language": "Латынь",
  "author": "Клифан",
  "date": "400 (1674) г.",
  "description": {
    "ru": "Латинский труд монаха Клифана (около 400 года; в скобках указан 1674 год), пересказывающий то, что он вычитал в «Некрономиконе». Большая часть текста посвящена защитным знакам и отродьям Ктулху. Экземпляры есть в Филдовском музее Чикаго, Британском музее и Объединённой теологической семинарии в Нью-Йорке.",
    "en": null
  },
  "reading": {
    "sanity_loss": "2d6",
    "mythos_initial": "+3%",
    "mythos_full": "+6%",
    "occult": null,
    "mythos_rating": 27,
    "study_time": "29 недель",
    "raw": "Потеря рассудка: 2d6. Мифы Ктулху: +3/+6%. Значение Мифов: 27. Изучение: 29 недель."
  },
  "spells": [
    {
      "name": "Вызов гнусных отродий океана («Связь со звёздным отродьем Ктулху»)",
      "spell": "coc:spell:contact-star-spawn-of-cthulhu"
    },
    {
      "name": "Знак хозяина («Знак Старших богов»)",
      "spell": "coc:spell:elder-sign"
    },
    {
      "name": "«Оберег»",
      "spell": "coc:spell:warding"
    }
  ],
  "refs": [
    "coc:creature:star-spawn-of-cthulhu"
  ],
  "axes": {
    "era": [
      "any"
    ],
    "ruleset": "core"
  },
  "sources": [
    {
      "book_id": "keeper-rulebook-ru",
      "physical_page": 207,
      "printed_page": 224,
      "method": "book_text",
      "verified": true
    },
    {
      "book_id": "keeper-rulebook-ru",
      "physical_page": 217,
      "printed_page": 235,
      "method": "book_text",
      "verified": true,
      "note": "таблица XI «Книги Мифов»"
    },
    {
      "book_id": "keeper-rulebook-en",
      "physical_page": 227,
      "printed_page": 226,
      "method": "book_text",
      "verified": true
    },
    {
      "book_id": "keeper-rulebook-en",
      "physical_page": 237,
      "printed_page": 236,
      "method": "book_text",
      "verified": true,
      "note": "Table XI: Mythos Tomes"
    }
  ],
  "quality": {
    "needs_review": false,
    "flags": [],
    "notes": "В английской «Книге хранителя» список заклинаний начинается с Cast Out the Devil («Изгнать дьявола»); в русском издании его нет."
  }
}
