{
  "schema": "sourcefold.tome.v0",
  "id": "coc:tome:uralteschrecken",
  "kind": "tome",
  "name": {
    "ru": "Uralteschrecken",
    "en": "Uralteschrecken"
  },
  "tome_type": "mythos_tome",
  "edition_of": null,
  "language": "Немецкий",
  "author": "Граф фон Конненберг",
  "date": "XIX в.",
  "reading": {
    "sanity_loss": "1d6",
    "mythos_initial": "+2%",
    "mythos_full": "+4%",
    "mythos_rating": 18,
    "study_time": "22 недели",
    "raw": "Uralteschrecken | Немецкий | XIX в. | Граф фон Конненберг | 22 | 1d6 | +2 | +4 | 18"
  },
  "axes": {
    "era": [
      "any"
    ],
    "ruleset": "core"
  },
  "sources": [
    {
      "book_id": "keeper-rulebook-ru",
      "physical_page": 219,
      "printed_page": 237,
      "method": "book_text",
      "verified": true,
      "note": "строка таблицы XI (название | язык | год/век | автор | недель | РАС | МКН | МКП | ЗМ)"
    },
    {
      "book_id": "keeper-rulebook-en",
      "physical_page": 239,
      "printed_page": 238,
      "method": "book_text",
      "verified": true
    }
  ],
  "quality": {
    "needs_review": false,
    "flags": []
  }
}
