{
  "schema": "sourcefold.tome.v0",
  "id": "coc:tome:necronomicon-latin",
  "kind": "tome",
  "name": {
    "ru": "Некрономикон (латынь)",
    "en": "Necronomicon (Latin)"
  },
  "tome_type": "mythos_tome",
  "edition_of": "coc:tome:necronomicon",
  "language": "Латынь",
  "author": "перевёл Олай Вормий",
  "date": "1228 г. н. э.",
  "description": {
    "ru": "Латинский перевод греческого текста, выполненный Олаем Вормием. Сначала ходил в рукописях; в конце XV века его отпечатали в Германии готическим шрифтом ин-фолио, а в начале XVII века почти без изменений переиздали в Испании. Известен один уцелевший экземпляр немецкого издания и четыре испанского — это и есть все пять сохранившихся «Некрономиконов».",
    "en": null
  },
  "reading": {
    "sanity_loss": "2d10",
    "mythos_initial": "+5%",
    "mythos_full": "+11%",
    "mythos_rating": 48,
    "study_time": "66 недель",
    "raw": "Потеря рассудка: 2d10. Мифы Ктулху: +5/+11%. Значение Мифов: 48. Изучение: 66 недель."
  },
  "spells": [
    {
      "name": "«Вызов/изгнание Азатота»",
      "spell": "coc:spell:call-dismiss-azathoth"
    },
    {
      "name": "«Вызов/изгнание Ктугхи»",
      "spell": "coc:spell:call-dismiss-cthugha"
    },
    {
      "name": "«Вызов/изгнание Хастура»",
      "spell": "coc:spell:call-dismiss-hastur"
    },
    {
      "name": "«Вызов/изгнание Ниогты»",
      "spell": "coc:spell:call-dismiss-nyogtha"
    },
    {
      "name": "«Вызов/изгнание Шуб-Ниггурат»",
      "spell": "coc:spell:call-dismiss-shub-niggurath"
    },
    {
      "name": "«Вызов/изгнание Йог-Сотота»",
      "spell": "coc:spell:call-dismiss-yog-sothoth"
    },
    {
      "name": "«Связь с упырём»",
      "spell": "coc:spell:contact-ghoul"
    },
    {
      "name": "«Связь с божеством: Ньярлатхотеп»",
      "spell": "coc:spell:contact-nyarlathotep"
    },
    {
      "name": "«Связь с обитателем песков»",
      "spell": "coc:spell:contact-sand-dweller"
    },
    {
      "name": "«Покорение»",
      "spell": "coc:spell:dominate"
    },
    {
      "name": "«Зловещее проклятье Азатота»",
      "spell": "coc:spell:dread-curse-of-azathoth"
    },
    {
      "name": "«Прах Сулеймана»",
      "spell": "coc:spell:dust-of-suleiman"
    },
    {
      "name": "«Знак Старших богов»",
      "spell": "coc:spell:elder-sign"
    },
    {
      "name": "«Порошок Ибн-Гази»",
      "spell": "coc:spell:powder-of-ibn-ghazi"
    },
    {
      "name": "«Воскрешение»",
      "spell": "coc:spell:resurrection"
    },
    {
      "name": "«Иссушение»",
      "spell": "coc:spell:shrivelling"
    },
    {
      "name": "«Призыв/укрощение бьякхи»",
      "spell": "coc:spell:summon-bind-byakhee"
    },
    {
      "name": "«Призыв/укрощение огненного вампира»",
      "spell": "coc:spell:summon-bind-fire-vampire"
    },
    {
      "name": "«Призыв/укрощение служителя Внешних богов»",
      "spell": "coc:spell:summon-bind-servitor-of-the-outer-gods"
    },
    {
      "name": "«Вурский знак»",
      "spell": "coc:spell:voorish-sign"
    }
  ],
  "axes": {
    "era": [
      "any"
    ],
    "ruleset": "core"
  },
  "sources": [
    {
      "book_id": "keeper-rulebook-ru",
      "physical_page": 209,
      "printed_page": 226,
      "method": "book_text",
      "verified": true
    },
    {
      "book_id": "keeper-rulebook-ru",
      "physical_page": 218,
      "printed_page": 236,
      "method": "book_text",
      "verified": true,
      "note": "строка таблицы XI"
    },
    {
      "book_id": "keeper-rulebook-en",
      "physical_page": 231,
      "printed_page": 230,
      "method": "book_text",
      "verified": true
    },
    {
      "book_id": "keeper-rulebook-en",
      "physical_page": 238,
      "printed_page": 237,
      "method": "book_text",
      "verified": true,
      "note": "строка таблицы XI"
    },
    {
      "book_id": "masks-of-nyarlathotep-en",
      "physical_page": 649,
      "printed_page": 646,
      "method": "book_text",
      "verified": true
    }
  ],
  "quality": {
    "needs_review": false,
    "flags": [],
    "notes": "Список заклинаний в книге — «те же, что и в „Аль-Азифе“»; здесь он развёрнут по статье «Аль-Азиф». В «Масках Ньярлатхотепа» (прил. C, святилище Раздутой женщины, с. 560) — испанское издание XVII века в переплёте цвета бычьей крови с застёжками в самоцветах; числа те же, о человекоподобных обликах Ньярлатхотепа сказано больше, о прочих — меньше; на полях от руки записан вариант «Врат», ведущий прямо к Ньярлатхотепу (20 ПМ)."
  }
}
