{
  "schema": "sourcefold.tome.v0",
  "id": "coc:tome:black-god-of-madness",
  "kind": "tome",
  "name": {
    "ru": "Чёрный бог безумия",
    "en": "Black God of Madness"
  },
  "tome_type": "mythos_tome",
  "edition_of": null,
  "language": "Английский",
  "author": "Амадей Карсон",
  "date": "1930-е",
  "description": {
    "ru": "В «Книге хранителя» описания нет — только строка таблицы XI «Книги Мифов»: английский, Амадей Карсон, 1930-е.",
    "en": null
  },
  "reading": {
    "sanity_loss": "1d6",
    "mythos_initial": "+1%",
    "mythos_full": "+3%",
    "occult": null,
    "mythos_rating": 12,
    "study_time": "7 недель",
    "raw": "Чёрный бог безумия | Английский | 1930-е | Амадей Карсон | 7 | 1d6 | +1 | +3 | 12"
  },
  "axes": {
    "era": [
      "any"
    ],
    "ruleset": "core"
  },
  "sources": [
    {
      "book_id": "keeper-rulebook-ru",
      "physical_page": 219,
      "printed_page": 237,
      "method": "book_text",
      "verified": true,
      "note": "таблица XI «Книги Мифов»"
    },
    {
      "book_id": "keeper-rulebook-en",
      "physical_page": 237,
      "printed_page": 236,
      "method": "book_text",
      "verified": true,
      "note": "Table XI: Mythos Tomes"
    }
  ],
  "quality": {
    "needs_review": false,
    "flags": []
  }
}
