{
  "schema": "sourcefold.tome.v0",
  "id": "coc:tome:gods-of-reality",
  "kind": "tome",
  "name": {
    "ru": "Боги реальности",
    "en": "Gods of Reality"
  },
  "tome_type": "mythos_tome",
  "edition_of": null,
  "language": "Английский",
  "author": "Роберт Хьюстон",
  "date": "1920-е годы",
  "description": {
    "ru": "Рукопись Роберта Хьюстона, которую он писал в начале 1920-х годов, живя в городе Великой Расы в Австралии: 600 листов без переплёта. Хьюстон утверждает, что вселенная настолько относительна, что ни один здравомыслящий человек не в силах её вообразить; люди, защищаясь, приучают себя не замечать свидетельств этого, но часть истин просачивается в сознание через то, что мы зовём снами. Он пишет о найденных в подземных туннелях записях о цивилизации, летавшей на огромных воздушных кораблях с ядерными двигателями, об устройстве йитианского контролёра разума и молниевых ружьях, о том, как отпугнуть, а иногда и убить летучих полипов, и о том, как по милости Ньярлатхотепа ему удалось вытянуть вперёд во времени йитианина Какакатака. Прочитавший рукопись получает также 1d6 пунктов к навыку чтения йитианских записей (Read (Yithian)).\nВ «Масках Ньярлатхотепа» (прил. C, Австралия) машинописная рукопись лежит в ящике стола в штабе Хьюстона в городе Великой Расы (с. 498, 500; бумаги Карлайла, Австралия, № 5). Суть можно уловить, бегло пролистав её примерно за полчаса; полное чтение занимает день. В рукописи есть пренебрежительное упоминание Омара аль-Шакти — ниточка в Египет — и указание на остров Серого Дракона и на то, что случится там 14 января 1926 года, — ниточка в Шанхай.",
    "en": null
  },
  "reading": {
    "sanity_loss": "1d3",
    "mythos_initial": "+0%",
    "mythos_full": "+1%",
    "mythos_rating": 3,
    "study_time": "1 день",
    "raw": "Sanity Loss: 1D3; Cthulhu Mythos: 0/+1 percentile; Mythos Rating: 3; Study: 1 day"
  },
  "spells": [
    {
      "name": "Time Trap*",
      "spell": "coc:spell:time-trap"
    },
    {
      "name": "Send Dream*",
      "spell": "coc:spell:send-dream"
    }
  ],
  "refs": [
    "coc:creature:great-race-of-yith-cone-body-form",
    "coc:creature:flying-polyp",
    "coc:creature:nyarlathotep"
  ],
  "axes": {
    "era": [
      "1920s"
    ],
    "ruleset": "core"
  },
  "sources": [
    {
      "book_id": "masks-of-nyarlathotep-en",
      "physical_page": 648,
      "printed_page": 645,
      "method": "book_text",
      "verified": true
    },
    {
      "book_id": "masks-of-nyarlathotep-en",
      "physical_page": 503,
      "printed_page": 500,
      "method": "book_text",
      "verified": true,
      "note": "где лежит рукопись: штаб Хьюстона, бумаги Карлайла, Австралия, № 5"
    }
  ],
  "quality": {
    "needs_review": false,
    "flags": [
      "translated"
    ],
    "notes": "Книга есть только в «Масках Ньярлатхотепа»."
  }
}
